COD_Categoria,Resumen
0,"Pero quizá tengamos algo que ganar adelantando nuestro consumo calórico, o al menos ese es el resultado de dos estudios recientes.Experimentar con la comida.
Parte de esto se debe al entorno que rodea este tumor, “impenetrable” para el sistema inmune según explican desde el BWH.
Serán necesarios, eso sí, más ensayos para definir mejor estos efectos secundarios.Las siguientes fases deberán determinar la eficacia y eficiencia del tratamiento.
Por ejemplo contamos con tratamientos que buscan reprogramar células cancerosas para atacar tumores, y virus bacteriófagos capaces de luchar contra temibles infecciones.En Xataka | Los cánceres en jóvenes se han disparado casi un 80% en 30 años.
Pero empecemos por el contexto, La obesidad infantil está íntimamente relacionada con una enorme cantidad de patologías y complicaciones: diabetes tipo 2, hipercolesterolemia, hipertensión, dolor articular, problemas respiratorios, hígado graso...
Eli Lilly confirmó la semana pasada a Bloomberg que tenía en marcha un estudio con adolescentes y acaba de terminar un pequeño ensayo con niños.
En esa horquilla se incluye el fármaco oral mayoritariamente, y también procedimientos en consulta, que a veces son inyectables.No obstante, Minoxidil no cabalga en solitario.
""Es muy eficaz, pero utilizado como única opción, en monoterapia, no mantiene la eficacia a largo plazo, hay que combinarlo con otros fármacos u otras terapias en función de cada caso.
Fortalecíamos su autoconcepto más allá de cómo se vieran físicamente"".Algunas mujeres van asumiendo con naturalidad su alopecia, pero incluso ellas pueden modular esa aceptación en función del escenario.
Algunas son problemas autoinmunes, otras de tipo hormonal... Hay que saber cuál tiene cada paciente y cómo tratarla"", remarca el doctor Saceda."
1,"También podemos decirle al asistente qué nos apetece ver con detalle y Alexa intentará acercarse lo máximo posible a nuestras indicaciones.Estos dos ejemplos, aunque no sean la cúspide de la innovación, son básicos para que el usuario pueda entender a lo que se está enfrentando con la nueva versión de Alexa basada en un LLM.
Sin embargo, está claro que Amazon no quiere quedarse atrás en la carrera de las IAs generativas, y Alexa era el producto que más encajaba en sus planes para poner en marcha este proyecto.En Xataka | Los mejores 21 juegos para Alexa: lista completa y cómo instalarAproximadamente 60.000 canciones se lanzan en Internet cada día en el mundo.
Durante décadas se han investigado varios métodos para dar con el ""hit"" perfecto: desde analizar las letras de las canciones, la tonalidad y los acordes e incluso las menciones que acumulan en las redes sociales.Ahora la ciencia ha dado un gran paso para resolver este misterio.
Sobre todo en un momento en el que la inteligencia artificial generativa ya permite a cualquier autor ""componer"" una canción en apenas unos minutos.Imágenes: Pexels En Xataka | Casi todos los supermercados ponen música de fondo mientras compras.
Aunque parece que está hasta en la sopa, el uso de la inteligencia artificial todavía es minoritaria en determinados entornos laborales y tiene connotaciones negativas.
Según The Guardian, algunas universidades australianas han detectado que ciertos alumnos están empleando chatbots para realizar sus trabajos de clase, como ensayos o incluso exámenes.
Wifi, 1000 W, Termostato Regulable, Temporizador, Soporte de pie, Protección sobrecalentamiento, BlancoNo pudo ser con Tanxugueiras, pero Galicia se prepara para un segundo asalto eurovisivo.
Al principio teníamos una idea muy cuadriculada, pero las distintas fases se acabaron solapando y dando un resultado mucho más rico”, señal Joel Cava, periodista de la agencia creativa Cecubo Group, impulsor del proyecto y quien ya se implicó el año pasado en una candidatura elabora desde Cataluña para el AI Song Contest.
Nos quedamos con las estrofas con menor intervención humana para dar así más protagonismo al trabajo de la máquina”, relata Cava.El proceso fue similar para las armonías.
El proceso ahora es bastante simple: el jurado escogerá a 15 clasificados entre el centenar largo de candidatos y los finalistas se batirán el cobre en un festival final abierto al voto ciudadano."
2,"Ya vimos a Drew Barrymore lanzar piedras sobre su imagen pública anunciando que se saltaba la huelga de guionistas para que su talk show 'The Drew Barrymore Show' volviera a ser emitido, y ahora tenemos a unos cuantos famosos luciendo sus mejores galas en Halloween.A la fiesta de Casamigos ha acudido gente tan popular como Jessica Alba, Justin Bieber, Margot Robbie, Tobey Maguire, Megan Fox, Machine Gun Kelly, Edward Norton, Paris Hilton o Cindy Crawford.
Las previsiones rondaban los 50 millones, lo que ya habría sido un punto de partida espectacular, pero el estreno ha rebasado todas las expectativas.
Las cifras son doblemente impresionantes si tenemos en cuenta que la película ha llegado al mismo tiempo a Peacock, lo que garantiza no solo acceso directo a los suscriptores del canal (pagando un extra de alquiler, eso sí), sino vía libre para la difusión de la película en internet por vías no autorizadas.
Usualmente el cine de terror comercial suele experimentar una caída en su segunda semana ('Halloween: El final', por ejemplo, cayó un 80% en su recaudación), pero en este caso puede que no suceda.
Por eso empresas como IMAX saben que no pueden depender solo de Hollywood y apoyan los mercados internacionales allí donde hace falta.
Se ha hablado mucho (el propio Kevin Feige lo ha hecho) del agotamiento paulatino que arrastra Marvel desde, aproximadamente, 'Endgame'.
Sin embargo, los espectadores quieren seguir consumiendo películas norteamericanas, y muchas salas están cumpliendo sus deseos proyectándolas de forma ilegal.
Es un fenómeno que sucede ya desde el año pasado, con copias no autorizadas de éxitos como 'The Batman' o 'Red'.El truco que están poniendo en marcha las salas con 'Barbie', tal y como cuentan medios como BBC o The New York Times, está en falsear el contenido de las proyecciones.
Con total honestidad: estos cines van a competir sin complejos en la primera división.Cuando este cine esté terminado será el único de Europa que apuesta en todas sus salas por pantallas LED.
Seguiremos cruzando los dedos.Cabecera: Sean Longform en Layered Butter / Vértice CineEn Xataka | 'Oppenheimer' es otro triunfo visual y creativo de Nolan."
3,"Aquellos  equipos representaban un verdadero soplo de aire fresco para este  segmento, y demostraban lo bien que macOS se había adaptado a la  arquitectura ARM.
Desde luego parece difícil  ir a peor, pero el escenario macroeconómico, con una inflación por las  nubes, no anima demasiado al gasto.
Eso y lo otro, claro.Que los M1, insisto, han resultado ser demasiado estupendos.En Xataka | Medio mundo apuesta por los chips ARM para el futuro del PC.
La demanda es débil, la incertidumbre interna y externa permanece, y las expectativas son aún relativamente pesimistas"".El debilitamiento de China está arrastrando a otros países asiáticos, como Japón, Corea del Sur, Malasia o Vietnam, debido a que estos últimos se nutren en gran medida del gigantesco mercado chino.
La actividad de sus fábricas crece sin descanso, aunque en octubre este crecimiento se ha ralentizado por segundo mes consecutivo.
Apple, Amazon, Google, AMD, Foxconn o Microsoft son algunas de las grandes corporaciones que ya están reforzando su infraestructura en India, y con toda probabilidad otras muchas van a seguir sus pasos en el futuro.
Que todos estos chips estén algo por debajo, sobre todo en el caso del M3 Pro, puede tener una explicación.Chips más pequeños (y baratos para Apple).
Por supuesto, en cuanto los nuevos MacBook Pro o iMac equipados con un chip M3 caigan en nuestras manos analizaremos a fondo su rendimiento.
Lo sabremos con seguridad cuando tengamos la oportunidad de analizar a fondo los primeros Mac equipados con estos chips, pero lo cierto es que, sobre el papel, las mejoras implementadas en su lógica gráfica pintan muy bien.
Apple repitió la jugada este mes de enero en sus Mac mini y MacBook Pro 14 en sus configuraciones básicas."
